id,nom,structure_porteuse,type_lieu,nature_juridique,statut,adresse_commune,tarifs,gratuit ou pas,description,siret,adresse_brut,adresse_numero,adresse_rue,adresse_code_postal,adresse_code_insee,adresse_departement,adresse_region,adresse_complément,latitude,longitude,itinerant,en_ligne,contact_telephone,contact_telephone_complement,contact_telephone_details,contact_telephone_complement_detail,contact_email,contact_web,contact_facebook,horaires_ouverture_brut,horaires_ouverture_osm,public_cible,modalites_acces,modalites_accompagnement,accessibilite,services,niveau_service,labels,geo_point
8,Emmaüs Connect,,Association,Association,Privé,Bordeaux,"Gratuit,Adhérent",avec condition,Nous mettons en place des activités dédiées à accompagner les personnes en difficulté numérique dans leur parcours. Nous les aidons à accéder à une offre solidaire pour s’équiper et se connecter tout en leur fournissant des outils pédagogiques pour appréhender seules ou accompagnées les services numériques essentiels à leur insertion sociale et professionnelle.,79200000000000,38 cours des Aubiers,38,Cours des Aubiers,33300,33063,Gironde,Nouvelle Aquitaine,,44.8729813595829,-0.57225924758073,,Non,646803329,,Mardi au Jeudi : 10h-13h/14h-17h45. Vendredi 10h-13h/14h-16h45.,,csbordeaux@emmaus-connect.org,https://emmaus-connect.org/bordeaux/,,Mardi au Jeudi : 10h-13h/14h-17h45. Vendredi 10h-13h/14h-16h45.,"Tu-Th 10:00-13:00,14:00-17:45; Fr 10:00-13:00,14:00-16:45",Tout public,Sur inscription ou rendez-vous,Collectif,,"Accès à un équipement informatique,Le public peut amener son propre matériel","TABLETTE/Expert,ORDI/Expert,INTERNET/Expert,MAILS/Expert,CV/Maîtrise,DIFFCV/Maîtrise,ORGRECHEMPLOI/Maîtrise,EMPLOISTORE/Maîtrise,DECLAPE/Basique,IMPOTS/Basique,DROITSSOCIAUXRSACAF/Basique,RETRAITE/Basique,CPAM/Basique,FACTURES/Basique,ETATCIVIL/Basique,PERMIS/Basique,PHOTO/Non,IMPTROISD/Non,PAO/Non,SITEWEB/Non,CODE/Non,MOOC/Basique",,"44.8729813596, -0.572259247581"
9,L'Atelier de No Working Bordeaux Bacalan,,Autre / Inconnu,Société par Actions Simplifiée (SAS),Privé,Bordeaux,Payant,avec condition,"L'atelier de No Working est un espace d'activités, d'échange et de partage à destination des seniors.",,19 rue Achard,19,Rue Achard,33300,33063,Gironde,Nouvelle Aquitaine,,44.8655620407963,-0.549216592052866,,Non,556376895,,Du Lundi au Vendredi : 9h12h30/13h30-18h.,,contact@atelierdenoworking.fr,https://atelierdenoworking.fr/,https://www.facebook.com/atelierdenoworking,Du Lundi au Vendredi : 9h12h30/13h30-18h.,"Mo-Fr 09:00-12:30,13:30-18:00",Séniors,Sur inscription ou rendez-vous,"Individuel,Collectif",,"Accès à un équipement informatique,Le public peut amener son propre matériel","TABLETTE/Basique,ORDI/Non,INTERNET/Basique,MAILS/Basique,CV/Non,DIFFCV/Non,ORGRECHEMPLOI/Non,EMPLOISTORE/Non,DECLAPE/Non,IMPOTS/Non,DROITSSOCIAUXRSACAF/Non,RETRAITE/Non,CPAM/Non,FACTURES/Non,ETATCIVIL/Non,PERMIS/Non,PHOTO/Basique,IMPTROISD/Non,PAO/Non,SITEWEB/Non,CODE/Non,MOOC/Non",,"44.8655620408, -0.549216592053"
10,Pôle Emploi Gironde - Bordeaux Nord,Pôle Emploi,Pôle Emploi,Autre,Public,Bordeaux,Gratuit,gratuit sans restrictions,"Accueille et accompagne toute personne à la recherche d'un emploi, d'une formation, d'un conseil professionnelle, d'une aide à la mobilité ou à l'insertion sociale et professionnelle.Indemnise les personnes relevant de l'assurance-chômage. Conseille et accompagne les entreprises dans leurs recrutements. Relaie les politiques publiques en relation avec ses missions.",,5 place Ravezies,5,Place Ravezies,33000,33063,Gironde,Nouvelle Aquitaine,Immeuble le 5,44.8373274551188,-0.572872104001035,,Non,3949,,Réception sans rendez-vous  les matin du Lundi au Vendredi de 8h30 à 12h30 et sur rendez-vous les après-midi sauf le Jeudi.,,Non communiqué,https://www.pole-emploi.fr,,Réception sans rendez-vous  les matin du Lundi au Vendredi de 8h30 à 12h30 et sur rendez-vous les après-midi sauf le Jeudi.,Mo-Fr 08:30-12:30,Demandeurs d'emploi,Sur inscription ou rendez-vous,"Individuel,Collectif",,Accès à un équipement informatique,"TABLETTE/Non,ORDI/Non,INTERNET/Non,MAILS/Non,CV/Expert,DIFFCV/Expert,ORGRECHEMPLOI/Expert,EMPLOISTORE/Expert,DECLAPE/Expert,IMPOTS/Non,DROITSSOCIAUXRSACAF/Non,RETRAITE/Non,CPAM/Non,FACTURES/Non,ETATCIVIL/Non,PERMIS/Non,PHOTO/Non,IMPTROISD/Non,PAO/Non,SITEWEB/Non,CODE/Non,MOOC/Non",,"44.8373274551, -0.572872104001"
12,Chantecler Bordeaux,,Association,Association,Privé,Bordeaux,Payant,avec condition,"Aujourd’hui c’est 61 activités proposées pour 3600 pratiquants. Cette belle aventure doit sa réussite aux bénévoles, aux salariés et aux adhérents qui se sont succédés au cours de ces 92 années passées. Nous serons donc très prochainement CENTENAIRE… Nous nous sommes attachés à préserver les valeurs qui ont initié CHANTECLER : accueil pour tous, solidarité et esprit d’équipe.",,impasse Ste Elisabeth,,Impasse Sainte Elisabeth,33000,33063,Gironde,Nouvelle Aquitaine,,44.8541256031603,-0.57673879988569,,Non,557870257,556089855,"Lundi, Mardi, Mercredi, Vendredi : 9h-12h30/13h30-18h.",,,http://www.maisondequartierchantecler.fr/,https://www.facebook.com/chantecler.asso.7,"Lundi, Mardi, Mercredi, Vendredi : 9h-12h30/13h30-18h.","Mo-Fr 09:00-12:30,13:30-18:00; Th off",Tout public,Sur inscription ou rendez-vous,Individuel,,"Accès à un équipement informatique,Le public peut amener son propre matériel","TABLETTE/Expert,ORDI/Expert,INTERNET/Expert,MAILS/Expert,CV/Basique,DIFFCV/Basique,ORGRECHEMPLOI/Non,EMPLOISTORE/Basique,DECLAPE/Basique,IMPOTS/Basique,DROITSSOCIAUXRSACAF/Basique,RETRAITE/Basique,CPAM/Basique,FACTURES/Basique,ETATCIVIL/Basique,PERMIS/Basique,PHOTO/Basique,IMPTROISD/Non,PAO/Basique,SITEWEB/Non,CODE/Non,MOOC/Non",,"44.8541256032, -0.576738799886"
14,Foyer Fraternel Centre Social,,Centre social,Association,Privé,Bordeaux,Gratuit,gratuit sans restrictions,"Le Foyer Fraternel est à la fois un centre social & un organisme de formation. Il répond aux besoins éducatifs et de loisirs, aux besoins d’insertion sociale et de solidarité, aux besoins de formation et d’insertion professionnelle. L’association propose notamment des cours de Français (Alpha, FLE) et des ateliers pour le numérique. Elle compte 800 adhérents et 2500 usagers dans les quartiers Chartrons, Grand Parc, Jardin Public.",,23 rue Gouffrand,23,Rue Gouffrand,33300,33063,Gironde,Nouvelle Aquitaine,,44.8558462446764,-0.572110842345362,,Non,557871392,,Lundi au Vendredi : 9h-18h.,,accueil@foyerfraternel.fr,http://www.centresocial-foyerfraternel.fr/,https://www.facebook.com/foyerfraternelbordeaux/,Lundi au Vendredi : 9h-18h.,Mo-Fr 09:00-18:00,"Allocataires,Demandeurs d'emploi,Etrangers,Jeunes,Séniors",Sur inscription ou rendez-vous,"Individuel,Collectif",Handicap moteur,Accès à un équipement informatique,"TABLETTE/Expert,ORDI/Expert,INTERNET/Expert,MAILS/Expert,CV/Expert,DIFFCV/Expert,ORGRECHEMPLOI/Expert,EMPLOISTORE/Expert,DECLAPE/Expert,IMPOTS/Non,DROITSSOCIAUXRSACAF/Expert,RETRAITE/Non,CPAM/Expert,FACTURES/Non,ETATCIVIL/Non,PERMIS/Non,PHOTO/Non,IMPTROISD/Non,PAO/Non,SITEWEB/Non,CODE/Non,MOOC/Non",Autre dispositif,"44.8558462447, -0.572110842345"
17,Bibliothèque Mériadeck,Mairie de Bordeaux,Bibliothèque / Médiathèque,Collectivité locale ou territoriale,Public,Bordeaux,"Gratuit,Adhérent",avec condition,"La bibliothèque Mériadeck est la plus grande bibliothèque du réseau bordelais. C'est également l'une des plus grandes bibliothèques municipales de France, avec ses 8 000 m² ouverts au public ! L'offre de documents est vaste : le bâtiment abrite plus d'un million de documents dans des dizaines de kilomètres de rayonnages, soit en accès tout à fait simple et facile, dans les salles, pour l'emprunt à domicile ou la lecture sur place, soit en magasins.",21300000000000,85 cours du Maréchal Juin,85,Cours Maréchal Juin,33000,33063,Gironde,Nouvelle Aquitaine,,44.8351168280552,-0.586759237213544,,Non,556103000,,"Lundi et Jeudi : 13h à 19h / Mardi Mercredi et Vendredi : 10h-19h, Samedi : 10h-18h (espace Patrimoine 13h-18h), Dimanche : 14h-18h d'octobre à avril.",,dgac.lectpub@mairie-bordeaux.fr,http://bibliotheque.bordeaux.fr,https://www.facebook.com/bibliotheques.bordeaux/,"Lundi et Jeudi : 13h à 19h / Mardi Mercredi et Vendredi : 10h-19h, Samedi : 10h-18h (espace Patrimoine 13h-18h), Dimanche : 14h-18h d'octobre à avril.","Mo,Th 13:00-19:00; Tu,We,Fr 10:00-19:00; Sa 10:00-18:00; Oct-Apr Su 14:00-18:00",Tout public,Sur inscription ou rendez-vous,"Individuel,Collectif",Handicap moteur,Accès à un équipement informatique,"TABLETTE/Expert,ORDI/Expert,INTERNET/Expert,MAILS/Expert,CV/Basique,DIFFCV/Basique,ORGRECHEMPLOI/Basique,EMPLOISTORE/Basique,DECLAPE/Basique,IMPOTS/Basique,DROITSSOCIAUXRSACAF/Basique,RETRAITE/Basique,CPAM/Basique,FACTURES/Basique,ETATCIVIL/Basique,PERMIS/Basique,PHOTO/Maîtrise,IMPTROISD/Non,PAO/Maîtrise,SITEWEB/Basique,CODE/Non,MOOC/Maîtrise",,"44.8351168281, -0.586759237214"
21,CRIJ Nouvelle Aquitaine,,Association,Association,Privé,Bordeaux,Gratuit,gratuit sans restrictions,"L'information Jeunesse vise à informer tous les Jeunes sur tous les sujets en lien avec leurs démarches d'accès à l'autonomie. Le CRIJ Nouvelle Aquitaine est la tête de réseau régionale des 170 structures IJ du territoire et gère l'accueil des Jeunes sur ses trois sites de Bordeaux, Limoges et Poitiers.",,125 Cours Alsace Lorraine,125,Cours d'Alsace Et Lorraine,33000,33063,Gironde,Nouvelle Aquitaine,,44.8374899117795,-0.575839282860387,,Non,556560056,,Lundi 13h30-17h Mardi à Jeudi 10h-12h et 13h30-17h Vendredi 10h-12h et 13h30-16h30.,,bordeaux@crijna.fr,http://www.jeuneabordeaux.fr/,https://www.facebook.com/InfoJeunes.NA.Bordeaux.Europedirect/,Lundi 13h30-17h Mardi à Jeudi 10h-12h et 13h30-17h Vendredi 10h-12h et 13h30-16h30.,"Mo 13:30-17:00; Tu-Th 10:00-12:00,13:30-17:00; Fr 10:00-12:00,13:30-16:30",Jeunes,Sur inscription ou rendez-vous,"Individuel,Collectif",Handicap moteur,"Accès à un équipement informatique,Le public peut amener son propre matériel","TABLETTE/Maîtrise,ORDI/Maîtrise,INTERNET/Expert,MAILS/Expert,CV/Expert,DIFFCV/Maîtrise,ORGRECHEMPLOI/Expert,EMPLOISTORE/Maîtrise,DECLAPE/Maîtrise,IMPOTS/Maîtrise,DROITSSOCIAUXRSACAF/Maîtrise,RETRAITE/Basique,CPAM/Maîtrise,FACTURES/Maîtrise,ETATCIVIL/Maîtrise,PERMIS/Basique,PHOTO/Basique,IMPTROISD/Non,PAO/Basique,SITEWEB/Non,CODE/Non,MOOC/Maîtrise",APTIC,"44.8374899118, -0.57583928286"
24,Le Nom Lieu,,Tiers-lieu / Coworking / FabLab / Hackerspace,Association,Privé,Bordeaux,"Gratuit,Adhérent",avec condition,Le Nom Lieu est une association de l'ESS qui accompagne les Jeunes de 16 à 25 ans en situation de fragilité psychique et/ou d'exclusion sociale à partir de leurs affinités dans les domaines du numérique vers leur insertion sociale et professionnelle.,,Le Node 12 rue des faussets,12,Rue des Faussets,33000,33063,Gironde,Nouvelle Aquitaine,Le Node,44.840415176588,-0.570517578425619,,Non,625049296,,"Mercredi : 9h-17h, Samedi : 10h-13h.",,lenomlieu@gmail.com,https://lenomlieu.wordpress.com/accueil/,https://lenomlieu.org/accueil/?share=facebook&nb=1,"Mercredi : 9h-17h, Samedi : 10h-13h.",We 09:00-17:00; Sa 10:00-13:00,"Allocataires,Demandeurs d'emploi,Jeunes,Personnes en situation de handicap",Sur inscription ou rendez-vous,"Individuel,Collectif",,"Accès à un équipement informatique,Le public peut amener son propre matériel","TABLETTE/Expert,ORDI/Expert,INTERNET/Expert,MAILS/Expert,CV/Maîtrise,DIFFCV/Maîtrise,ORGRECHEMPLOI/Maîtrise,EMPLOISTORE/Non,DECLAPE/Non,IMPOTS/Non,DROITSSOCIAUXRSACAF/Non,RETRAITE/Non,CPAM/Non,FACTURES/Non,ETATCIVIL/Non,PERMIS/Non,PHOTO/Expert,IMPTROISD/Maîtrise,PAO/Expert,SITEWEB/Expert,CODE/Expert,MOOC/Expert",,"44.8404151766, -0.570517578426"
25,Oxygène,,Association,Association,Privé,Bordeaux,Payant,avec condition,"Nos missions s’inscrivent dans le champ de l’insertion sociale et dans la lutte contre les exclusions et l’isolement en amenant notre public, au travers de nos actions, à retisser du lien social, à retrouver confiance et estime de soi. Il s’agit de lever progressivement les freins et les obstacles à l’émergence de projets.",,27-29 quai Richelieu,27,Quai Richelieu,33000,33063,Gironde,Nouvelle Aquitaine,,44.8386536722948,-0.568043900826017,,Non,556969663,,Permanences tous les Mercredi après-midi.,,oxygene.asso@wanadoo.fr,http://oxygene-asso.fr/,,Permanences tous les Mercredi après-midi.,We 13:30-18:00,Tout public,Sur inscription ou rendez-vous,"Individuel,Collectif",,"Accès à un équipement informatique,Le public peut amener son propre matériel","TABLETTE/Basique,ORDI/Maîtrise,INTERNET/Maîtrise,MAILS/Maîtrise,CV/Maîtrise,DIFFCV/Basique,ORGRECHEMPLOI/Basique,EMPLOISTORE/Non,DECLAPE/Basique,IMPOTS/Basique,DROITSSOCIAUXRSACAF/Basique,RETRAITE/Basique,CPAM/Basique,FACTURES/Basique,ETATCIVIL/Basique,PERMIS/Non,PHOTO/Non,IMPTROISD/Non,PAO/Basique,SITEWEB/Non,CODE/Non,MOOC/Non",,"44.8386536723, -0.568043900826"
26,Philomathique de Bordeaux,,Association,Association,Privé,Bordeaux,Payant,avec condition,"Centre de formation professionnelle depuis 1808 à Bordeaux, spécialisé historiquement dans les métiers d'arts et d'artisanat et qui propose depuis 2015 des formations en lien avec le numérique, et notamment le web et ses usages. Les formations sont à la fois à destination de publics demandeurs d'emplois, particuliers ou en reconversion professionnelle. Ces actions sont diplômantes ou certifiantes. De plus des actions d'intérêt général sont ouvertes à destination des associations du territoire à travers l'action ""A l'Asso du Web"".",,66 rue Abbé de l'Epée,66,Rue Abbé de l'Epée,33000,33063,Gironde,Nouvelle Aquitaine,,44.8421776416482,-0.582816427120468,,Non,556522326,,Lundi au Vendredi : 8h30-18 h.,,communication@philomathiquebordeaux.com,https://www.philomathiquebordeaux.com/,,Lundi au Vendredi : 8h30-18 h.,Mo-Fr 08:30-18:00,Demandeurs d'emploi,Sur inscription ou rendez-vous,Collectif,,"Accès à un équipement informatique,Le public peut amener son propre matériel","TABLETTE/Non,ORDI/Non,INTERNET/Non,MAILS/Non,CV/Non,DIFFCV/Non,ORGRECHEMPLOI/Non,EMPLOISTORE/Non,DECLAPE/Non,IMPOTS/Non,DROITSSOCIAUXRSACAF/Non,RETRAITE/Non,CPAM/Non,FACTURES/Non,ETATCIVIL/Non,PERMIS/Non,PHOTO/Non,IMPTROISD/Non,PAO/Non,SITEWEB/Expert,CODE/Expert,MOOC/Non",,"44.8421776416, -0.58281642712"
29,Abracodabra,,Autre / Inconnu,Société à responsabilité limitée (SARL),Privé,Bordeaux,Payant,avec condition,"Abracodabra propose des ateliers de création numérique pour les enfants et adolescents de 4 à 15 ans. Durant les vacances scolaires ou pour des ateliers hebdomadaires, les Jeunes utilise le numérique comme un outil pour créer des robots, sites web, jeux vidéo, etc.",,77 rue Lecocq,77,Rue Lecocq,33000,33063,Gironde,Nouvelle Aquitaine,,44.8342970402626,-0.586211937760128,,Non,557657539,,Selon programme d’ateliers.,,contact@abracodabra.fr,http://www.abracodabra.fr/,https://www.facebook.com/abracodabrabx/,Selon programme d’ateliers.,,"Jeunes,Personnes en situation de handicap",Sur inscription ou rendez-vous,Collectif,,"Accès à un équipement informatique,Le public peut amener son propre matériel","TABLETTE/Basique,ORDI/Basique,INTERNET/Basique,MAILS/Non,CV/Non,DIFFCV/Non,ORGRECHEMPLOI/Non,EMPLOISTORE/Non,DECLAPE/Non,IMPOTS/Non,DROITSSOCIAUXRSACAF/Non,RETRAITE/Non,CPAM/Non,FACTURES/Non,ETATCIVIL/Non,PERMIS/Non,PHOTO/Expert,IMPTROISD/Expert,PAO/Non,SITEWEB/Expert,CODE/Expert,MOOC/Non",,"44.8342970403, -0.58621193776"
34,Bibliothèque Capucins / St Michel,Mairie de Bordeaux,Bibliothèque / Médiathèque,Collectivité locale ou territoriale,Public,Bordeaux,"Gratuit,Adhérent",avec condition,"Au cœur du quartier St Michel, quartier de palabres et de saveurs, la bibliothèque met à l'honneur le théâtre et la poésie. Face au marché des Capucins, la bibliothèque vous accueille pour un temps de lecture, de rêverie... ou une simple pause, pour consulter la presse ou internet.",21300000000000,10-12 place des Capucins,10,Place des Capucins,33800,33063,Gironde,Nouvelle Aquitaine,,44.8308018716672,-0.567016016608649,,Non,556911879,,"Mardi : 10h-12h/14h-18h, Mercredi et Samedi : 10h-18h, Jeudi et Vendredi : 14h-18h.",,dgac.lectpub@mairie-bordeaux.fr,http://bibliotheque.bordeaux.fr,https://www.facebook.com/bibliotheques.bordeaux/,"Mardi : 10h-12h/14h-18h, Mercredi et Samedi : 10h-18h, Jeudi et Vendredi : 14h-18h.","Tu 10:00-12:00,14:00-18:00; We,Sa 10:00-18:00; Th,Fr 14:00-18:00",Tout public,Sur inscription ou rendez-vous,"Individuel,Collectif",Handicap moteur,"Accès à un équipement informatique,Le public peut amener son propre matériel","TABLETTE/Basique,ORDI/Basique,INTERNET/Basique,MAILS/Expert,CV/Basique,DIFFCV/Basique,ORGRECHEMPLOI/Non,EMPLOISTORE/Non,DECLAPE/Basique,IMPOTS/Basique,DROITSSOCIAUXRSACAF/Basique,RETRAITE/Basique,CPAM/Basique,FACTURES/Basique,ETATCIVIL/Basique,PERMIS/Basique,PHOTO/Basique,IMPTROISD/Non,PAO/Basique,SITEWEB/Non,CODE/Non,MOOC/Basique",,"44.8308018717, -0.567016016609"
35,Bibliothèque Flora Tristan,Mairie de Bordeaux,Bibliothèque / Médiathèque,Collectivité locale ou territoriale,Public,Bordeaux,"Gratuit,Adhérent",avec condition,"10 fois plus grande que l’ancienne bibliothèque Son Tay, chaleureuse, équipée d’espaces multimédia, de jeux vidéo et d'une grande salle d'animation, elle propose des services numériques innovants et des collections variées pour tous.",21300000000000,1 place d'Armagnac,1,Place d'Armagnac,33800,33063,Gironde,Nouvelle Aquitaine,,44.8212741540285,-0.550768072761059,,Non,524996012,,"Mardi : 10h-12h/14h-18h, Mercredi et Samedi : 10h-18h, Jeudi et Vendredi : 14h-18h.",,dgac.lectpub@mairie-bordeaux.fr,http://bibliotheque.bordeaux.fr,https://www.facebook.com/bibliotheques.bordeaux/,"Mardi : 10h-12h/14h-18h, Mercredi et Samedi : 10h-18h, Jeudi et Vendredi : 14h-18h.","Tu 10:00-12:00,14:00-18:00; We,Sa 10:00-18:00; Th,Fr 14:00-18:00",Tout public,Sur inscription ou rendez-vous,"Individuel,Collectif",Handicap moteur,"Accès à un équipement informatique,Le public peut amener son propre matériel","TABLETTE/Maîtrise,ORDI/Maîtrise,INTERNET/Maîtrise,MAILS/Maîtrise,CV/Basique,DIFFCV/Basique,ORGRECHEMPLOI/Basique,EMPLOISTORE/Basique,DECLAPE/Basique,IMPOTS/Basique,DROITSSOCIAUXRSACAF/Basique,RETRAITE/Basique,CPAM/Basique,FACTURES/Basique,ETATCIVIL/Basique,PERMIS/Basique,PHOTO/Maîtrise,IMPTROISD/Non,PAO/Maîtrise,SITEWEB/Basique,CODE/Basique,MOOC/Maîtrise",,"44.821274154, -0.550768072761"
44,Bibliothèque Pierre Veilletet,Mairie de Bordeaux,Bibliothèque / Médiathèque,Collectivité locale ou territoriale,Public,Bordeaux,"Gratuit,Adhérent",avec condition,"La bibliothèque Pierre Veilletet du quartier Caudéran a ouvert le 8 juin 2019. Elle est située sur la place Eugène Gauthier, dans un pôle regroupant un ensemble scolaire, un complexe sportif, une piscine, un skatepark, des commerces de proximité et le marché hebdomadaire. Elle a pour objectif d’être un lieu de rencontres et d’échanges accessible, convivial et confortable pour les habitants du quartier.",21300000000000,21 rue Domion,21,Rue Domion,33200,33063,Gironde,Nouvelle Aquitaine,,44.8576510865659,-0.623685335493888,,Non,524576760,,"Mardi et Vendredi : 10h-12h/14h-18h, Mercredi et Samedi : 10h-18h.",,dgac.lectpub@mairie-bordeaux.fr,http://bibliotheque.bordeaux.fr,https://www.facebook.com/bibliotheques.bordeaux/,"Mardi et Vendredi : 10h-12h/14h-18h, Mercredi et Samedi : 10h-18h.","Tu,Fr 10:00-12:00,14:00-18:00; We,Sa 10:00-18:00",Tout public,Sur inscription ou rendez-vous,"Individuel,Collectif",Handicap moteur,"Accès à un équipement informatique,Le public peut amener son propre matériel","TABLETTE/Expert,ORDI/Expert,INTERNET/Expert,MAILS/Expert,CV/Basique,DIFFCV/Basique,ORGRECHEMPLOI/Basique,EMPLOISTORE/Basique,DECLAPE/Basique,IMPOTS/Basique,DROITSSOCIAUXRSACAF/Basique,RETRAITE/Basique,CPAM/Basique,FACTURES/Basique,ETATCIVIL/Basique,PERMIS/Basique,PHOTO/Maîtrise,IMPTROISD/Basique,PAO/Maîtrise,SITEWEB/Basique,CODE/Basique,MOOC/Maîtrise",,"44.8576510866, -0.623685335494"
51,Ligue de l'enseignement – Fédération de la Gironde,,Association,Association,Privé,Artigues-près-Bordeaux,"Gratuit,Adhérent",avec condition,"La Ligue de l’enseignement réunit des femmes et des hommes qui agissent au quotidien pour mieux vivre ensemble, lutter contre les inégalités et pour faire vivre une démocratie plus effective. L’identité de la Ligue de l'Enseignement se fonde sur le triptyque : Démocratie - Laïcité   Education. Ces actions se déclinent en plusieurs formats : formations, animations, ateliers, évènementiels, festivals culturels, centre de ressources pour les associations affiliées, etc. Elles s adressent aussi bien aux enfants scolarisais qu’à tous les publics défavorisés, fragilisés ou discriminés, des jeunes aux Seniors.",,"château BétailheBètailhe , 72 avenue de l'Eglise romane",72,Avenue de l'Eglise Romane,33370,33013,Gironde,Nouvelle Aquitaine,,44.8587549498054,-0.497308676329456,,Non,556445225,,Du Lundi au Vendredi : 9h-12h/13h30-17h.,,contact@laligue33.org,,https://www.facebook.com/liguedelenseignement.gironde/,Du Lundi au Vendredi : 9h-12h/13h30-17h.,"Mo-Fr 09:00-12:00,13:30-17:00","Jeunes,Personnes en situation de handicap,Séniors",,Collectif,Handicap moteur,"Accès à un équipement informatique,Le public peut amener son propre matériel","TABLETTE/Expert,ORDI/Expert,INTERNET/Expert,MAILS/Expert,CV/Non,DIFFCV/Non,ORGRECHEMPLOI/Non,EMPLOISTORE/Non,DECLAPE/Non,IMPOTS/Expert,DROITSSOCIAUXRSACAF/Expert,RETRAITE/Maîtrise,CPAM/Expert,FACTURES/Expert,ETATCIVIL/Expert,PERMIS/Expert,PHOTO/Maîtrise,IMPTROISD/Non,PAO/Expert,SITEWEB/Maîtrise,CODE/Maîtrise,MOOC/Expert",,"44.8587549498, -0.497308676329"
53,CCAS Carbon-Blanc,,"Commune (Ville, CCAS, Centre Culturel…)",Collectivité locale ou territoriale,Public,Carbon-Blanc,Gratuit,gratuit sans restrictions,"Le CCAS participe au développement d'une offre cohérente, coordonnée et complémentaire d'accompagnement au numérique. sur le territoire de Carbon-Blanc. Porté par le Pôle insertion du CCAS, il permet de répondre à la mission initiale de l’établissement qui est de favoriser l’intégration des populations les plus fragiles.",,Maison pour tous Parc Favols,,Maison pour tous Parc Favols,33560,,Gironde,Nouvelle Aquitaine,,,,,Non,557776887,,"Lundi: 8h30-12h/13h30-18h. Mardi, Mercredi, Jeudi: 8h30-12h/13h30-17h. Vendredi: 8h30-12h/13h30-16h.",,an.garnier@carbon-blanc.fr,https://www.carbon-blanc.fr/a-tout-age/solidarites/le-centre-communal-daction-sociale-2.html,,"Lundi: 8h30-12h/13h30-18h. Mardi, Mercredi, Jeudi: 8h30-12h/13h30-17h. Vendredi: 8h30-12h/13h30-16h.","Mo 08:30-12:00,13:30-18:00; Tu-Th 08:30-12:00,13:30-17:00; Fr 08:30-12:00,13:30-16:00","Allocataires,Etrangers,Jeunes,Personnes en situation de handicap,Séniors",Sur inscription ou rendez-vous,Individuel,Handicap moteur,Accès à un équipement informatique,"TABLETTE/Maîtrise,ORDI/Basique,INTERNET/Maîtrise,MAILS/Maîtrise,CV/Basique,DIFFCV/Basique,ORGRECHEMPLOI/Basique,EMPLOISTORE/Basique,DECLAPE/Maîtrise,IMPOTS/Basique,DROITSSOCIAUXRSACAF/Maîtrise,RETRAITE/Basique,CPAM/Maîtrise,FACTURES/Maîtrise,ETATCIVIL/Maîtrise,PERMIS/Maîtrise,PHOTO/Non,IMPTROISD/Non,PAO/Non,SITEWEB/Non,CODE/Non,MOOC/Non",Autre dispositif,
56,Le Pixel Relai numérique de Cenon,Mairie de Cenon,"Commune (Ville, CCAS, Centre Culturel…)",Collectivité locale ou territoriale,Public,Cenon,"Gratuit,Adhérent",avec condition,"Le Pixel est un espace numérique ouvert à tous les publics souhaitant découvrir et s’initier aux outils multimédia. C'est un lieu d’échanges de savoirs et de communication. Le lieu propose en accès libre des ordinateurs et autres équipements (connexion internet, logiciel, scanner). Vous pouvez aussi perfectionner vos connaissances en participant à des ateliers sur des thématiques diverses (Bureautique Internet, Réseaux Sociaux, Photo ). Une équipe de médiateurs numériques vous accompagne lors de vos différentes démarches administratives.",,Maison des Associations 11 rue du 8 Mai 1945,11,Rue du 8 Mai 1945,33150,33119,Gironde,Nouvelle Aquitaine,Maison des Associations,44.8521127117729,-0.513358806912427,,Non,556678066,,"Mardi, Mercredi, Vendredi : 10h30-12h30/14h-17h30. Jeudi : 14h-17h30. Samedi :10h30-13h.",,lepixel@ville-cenon.fr,https://pixel.cenon.fr/,http://facebook.com/lepixelrelaisnumerique,"Mardi, Mercredi, Vendredi : 10h30-12h30/14h-17h30. Jeudi : 14h-17h30. Samedi :10h30-13h.","Tu-Fr 10:30-12:30,14:00-17:30; Th 14:00-17:30; Sa 10:30-13:00",Tout public,Sur inscription ou rendez-vous,"Individuel,Collectif",Handicap moteur,"Accès à un équipement informatique,Le public peut amener son propre matériel","TABLETTE/Maîtrise,ORDI/Expert,INTERNET/Expert,MAILS/Expert,CV/Basique,DIFFCV/Expert,ORGRECHEMPLOI/Maîtrise,EMPLOISTORE/Maîtrise,DECLAPE/Expert,IMPOTS/Expert,DROITSSOCIAUXRSACAF/Maîtrise,RETRAITE/Maîtrise,CPAM/Maîtrise,FACTURES/Maîtrise,ETATCIVIL/Expert,PERMIS/Expert,PHOTO/Maîtrise,IMPTROISD/Non,PAO/Maîtrise,SITEWEB/Maîtrise,CODE/Maîtrise,MOOC/Basique",,"44.8521127118, -0.513358806912"
